{
  "task_id": "abc-09",
  "owner": "codex-astra-high",
  "run_id": "abc-09-development",
  "control_repo": "/Users/viggomeesters/Dev/go-workflow-stack",
  "path": "/Users/viggomeesters/Documents/Codex/2026-09-13/vr/work/abc-09",
  "branch": "codex/abc-09",
  "base_branch": "main",
  "base_commit": "2abed62dcb0937836ce0816e07b7547416a0bcb1",
  "schema": "go-workflow.workspace-state.v1",
  "common_dir": "/Users/viggomeesters/Dev/go-workflow-stack/.git",
  "repository_id": "51c2a12a0f224916b1585e3dfe1bf86f",
  "generation": "75e878737ac6466d8a60f7f10ec5aac6",
  "state": "integrated",
  "integration": {
    "workspace_head": "3fe1dbb813556492350f49e83191f4fd4afe9caf",
    "integrated_commit": "3fe1dbb813556492350f49e83191f4fd4afe9caf"
  }
}
