{
  "task_id": "reliability-04",
  "owner": "codex-astra-high",
  "run_id": "reliability-04-development",
  "control_repo": "/Users/viggomeesters/Dev/go-workflow-stack",
  "path": "/Users/viggomeesters/Documents/Codex/2026-09-13/vr/work/reliability-04",
  "branch": "codex/reliability-04",
  "base_branch": "main",
  "base_commit": "66c66d0f7a9383caf29b8ef3649e68995c78cb6d",
  "schema": "go-workflow.workspace-state.v1",
  "common_dir": "/Users/viggomeesters/Dev/go-workflow-stack/.git",
  "repository_id": "51c2a12a0f224916b1585e3dfe1bf86f",
  "generation": "9d2bf5456a7843cab45e549268b12e25",
  "state": "integrated",
  "integration": {
    "workspace_head": "4c8522b50581e3ddf674cffcca08ff997f34b9b7",
    "integrated_commit": "4c8522b50581e3ddf674cffcca08ff997f34b9b7"
  }
}
